{
  "schema_version": 2,
  "contract": "irish_phrase_family",
  "id": "d32.limerick.06.balla.wall",
  "county": "limerick",
  "story_ref": {
    "path": "content/audio/authoring/d32-county-harvest-uses.json",
    "record_id": "d32.limerick.treaty-of-limerick"
  },
  "target": {
    "lexeme_id": "lex.balla",
    "citation_form": "balla",
    "sense_id": "limerick.balla.wall",
    "part_of_speech": "noun",
    "english_sense": "wall"
  },
  "atlas_placements": [
    {
      "id": "atlas.limerick.06.balla",
      "gloss": "wall"
    }
  ],
  "status": "draft",
  "claims": {
    "linguistic_approval": false,
    "historical_authenticity": false,
    "note": "D32 provisional family; text is invented pedagogical material and carries no attestation or release claim."
  },
  "members": [
    {
      "id": "d32.limerick.06.balla.wall.opening",
      "family_id": "d32.limerick.06.balla.wall",
      "target": {
        "lexeme_id": "lex.balla",
        "citation_form": "balla",
        "sense_id": "limerick.balla.wall",
        "part_of_speech": "noun",
        "target_form": "balla",
        "morphology": "atlas citation form; provisional surrounding frame"
      },
      "irish": {
        "text": "Tá balla anseo.",
        "normalized_text": "Tá balla anseo.",
        "inventory_slug": "taa-balla-anseo",
        "text_sha256": "b994f3ff9a3f03a2e1ef382b3aea5b790f20f62ffa2b23e835121d92d036ccaa"
      },
      "english": {
        "intent": "The wall is here.",
        "literal_note": "D32 invented pedagogical line; not an attested quotation."
      },
      "binding": {
        "county": "limerick",
        "story_ref": {
          "path": "content/audio/authoring/d32-county-harvest-uses.json",
          "record_id": "d32.limerick.treaty-of-limerick"
        },
        "atlas_placement_ids": [
          "atlas.limerick.06.balla"
        ],
        "place": {
          "id": "d32.limerick.place",
          "label": "Luimneach / Limerick"
        },
        "setting": "present_day",
        "learner_role": "present_day_self"
      },
      "learning": {
        "stages": [
          "introduction"
        ],
        "roles": [
          "story_opening"
        ],
        "dialect": "standard Irish; provisional county context",
        "register": "neutral pedagogical frame",
        "purpose": "Open the limerick story with the atlas-bound wall at its named place.",
        "fixture_only": false
      },
      "exercise_consumers": [
        {
          "path": "content/audio/authoring/d32-county-harvest-uses.json",
          "record_id": "d32.limerick.treaty-of-limerick.opening.06",
          "response_family": "listenChoose",
          "container": "none",
          "use": "Open the limerick story with the atlas-bound wall at its named place."
        }
      ],
      "provenance": {
        "origin": "invented_pedagogical",
        "invented": true,
        "composition_note": "Deterministically composed from the provisional atlas gloss and the county story-slate place binding for the D32 emergency harvest; not attested text.",
        "source_refs": [
          {
            "path": "content/audio/authoring/d32-county-harvest-uses.json",
            "record_id": "d32.limerick.treaty-of-limerick.opening.06",
            "supports": "exercise_context"
          }
        ]
      },
      "states": {
        "authoring": {
          "status": "complete",
          "revision": 1,
          "author_ref": "track-a.d32-scale-authoring",
          "completed_at": "2026-08-02"
        },
        "reviews": {
          "editorial": {
            "status": "pending",
            "record": null
          },
          "pedagogy": {
            "status": "pending",
            "record": null
          },
          "irish_language": {
            "status": "pending",
            "record": null
          }
        },
        "capture_request": {
          "status": "requested",
          "requested_by": "codex.track-a.d32",
          "requested_at": "2026-08-02T10:52:00Z",
          "authorization": {
            "basis": "d32_emergency_harvest",
            "authorized_by": "user.d32.scale.019fc1ba",
            "authorized_at": "2026-08-02T10:52:00Z",
            "reason": "Explicit D32 emergency-harvest authorization for provisional capture; review and learner release remain blocked.",
            "fixture_only": false,
            "harvest_deadline": "2026-08-11",
            "learner_release_blocked": true
          },
          "batch_line_ids": [
            "d32.harvest.derry.d32-derry-city-walls-siege.part-01.line.8c623de0dd6cf97f"
          ]
        },
        "audio_qa": {
          "status": "not_generated",
          "record": null,
          "batch_line_id": null
        },
        "learner_release": {
          "status": "blocked",
          "reasons": [
            "invented_text",
            "editorial_review_pending",
            "pedagogy_review_pending",
            "irish_language_review_pending",
            "audio_not_generated"
          ]
        }
      },
      "risk_flags": [
        "audio_pronunciation",
        "fada",
        "invented_text",
        "source_ambiguity"
      ]
    },
    {
      "id": "d32.limerick.06.balla.wall.return",
      "family_id": "d32.limerick.06.balla.wall",
      "target": {
        "lexeme_id": "lex.balla",
        "citation_form": "balla",
        "sense_id": "limerick.balla.wall",
        "part_of_speech": "noun",
        "target_form": "balla",
        "morphology": "atlas citation form; provisional surrounding frame"
      },
      "irish": {
        "text": "Tá balla sa scéal.",
        "normalized_text": "Tá balla sa scéal.",
        "inventory_slug": "taa-balla-sa-sceeal",
        "text_sha256": "c4a244908ba394c5280afc2fe0ef1a800c4f3218d92383239a099ab8c83ef540"
      },
      "english": {
        "intent": "The wall is in the story.",
        "literal_note": "D32 invented pedagogical line; not an attested quotation."
      },
      "binding": {
        "county": "limerick",
        "story_ref": {
          "path": "content/audio/authoring/d32-county-harvest-uses.json",
          "record_id": "d32.limerick.treaty-of-limerick"
        },
        "atlas_placement_ids": [
          "atlas.limerick.06.balla"
        ],
        "place": {
          "id": "d32.limerick.place",
          "label": "Luimneach / Limerick"
        },
        "setting": "present_day",
        "learner_role": "present_day_self"
      },
      "learning": {
        "stages": [
          "later_reuse"
        ],
        "roles": [
          "story_recap"
        ],
        "dialect": "standard Irish; provisional county context",
        "register": "neutral pedagogical frame",
        "purpose": "Carry balla from the place opening into a reusable story recap.",
        "fixture_only": false
      },
      "exercise_consumers": [
        {
          "path": "content/audio/authoring/d32-county-harvest-uses.json",
          "record_id": "d32.limerick.treaty-of-limerick.return.06",
          "response_family": "freeTyping",
          "container": "none",
          "use": "Carry balla from the place opening into a reusable story recap."
        }
      ],
      "provenance": {
        "origin": "invented_pedagogical",
        "invented": true,
        "composition_note": "Deterministically composed from the provisional atlas gloss and the county story-slate place binding for the D32 emergency harvest; not attested text.",
        "source_refs": [
          {
            "path": "content/audio/authoring/d32-county-harvest-uses.json",
            "record_id": "d32.limerick.treaty-of-limerick.return.06",
            "supports": "exercise_context"
          }
        ]
      },
      "states": {
        "authoring": {
          "status": "complete",
          "revision": 1,
          "author_ref": "track-a.d32-scale-authoring",
          "completed_at": "2026-08-02"
        },
        "reviews": {
          "editorial": {
            "status": "pending",
            "record": null
          },
          "pedagogy": {
            "status": "pending",
            "record": null
          },
          "irish_language": {
            "status": "pending",
            "record": null
          }
        },
        "capture_request": {
          "status": "requested",
          "requested_by": "codex.track-a.d32",
          "requested_at": "2026-08-02T10:52:00Z",
          "authorization": {
            "basis": "d32_emergency_harvest",
            "authorized_by": "user.d32.scale.019fc1ba",
            "authorized_at": "2026-08-02T10:52:00Z",
            "reason": "Explicit D32 emergency-harvest authorization for provisional capture; review and learner release remain blocked.",
            "fixture_only": false,
            "harvest_deadline": "2026-08-11",
            "learner_release_blocked": true
          },
          "batch_line_ids": [
            "d32.harvest.fermanagh.d32-fermanagh-enniskillen-castle.part-01.line.9601310e98c4a49a"
          ]
        },
        "audio_qa": {
          "status": "not_generated",
          "record": null,
          "batch_line_id": null
        },
        "learner_release": {
          "status": "blocked",
          "reasons": [
            "invented_text",
            "editorial_review_pending",
            "pedagogy_review_pending",
            "irish_language_review_pending",
            "audio_not_generated"
          ]
        }
      },
      "risk_flags": [
        "audio_pronunciation",
        "fada",
        "invented_text",
        "source_ambiguity"
      ]
    }
  ]
}
