{
  "schema_version": 2,
  "contract": "irish_phrase_family",
  "id": "d32.westmeath.10.uisce.water",
  "county": "westmeath",
  "story_ref": {
    "path": "content/audio/authoring/d32-county-harvest-uses.json",
    "record_id": "d32.westmeath.st-fechin-fore"
  },
  "target": {
    "lexeme_id": "lex.uisce",
    "citation_form": "uisce",
    "sense_id": "westmeath.uisce.water",
    "part_of_speech": "noun",
    "english_sense": "water"
  },
  "atlas_placements": [
    {
      "id": "atlas.westmeath.10.uisce",
      "gloss": "water"
    }
  ],
  "status": "draft",
  "claims": {
    "linguistic_approval": false,
    "historical_authenticity": false,
    "note": "D32 provisional family; text is invented pedagogical material and carries no attestation or release claim."
  },
  "members": [
    {
      "id": "d32.westmeath.10.uisce.water.opening",
      "family_id": "d32.westmeath.10.uisce.water",
      "target": {
        "lexeme_id": "lex.uisce",
        "citation_form": "uisce",
        "sense_id": "westmeath.uisce.water",
        "part_of_speech": "noun",
        "target_form": "uisce",
        "morphology": "atlas citation form; provisional surrounding frame"
      },
      "irish": {
        "text": "Tá uisce anseo.",
        "normalized_text": "Tá uisce anseo.",
        "inventory_slug": "taa-uisce-anseo",
        "text_sha256": "7c9ae77242a14b68b9a10bd086d0a1d6c50f94bc1317658354102b0f7bd87b27"
      },
      "english": {
        "intent": "The water is here.",
        "literal_note": "D32 invented pedagogical line; not an attested quotation."
      },
      "binding": {
        "county": "westmeath",
        "story_ref": {
          "path": "content/audio/authoring/d32-county-harvest-uses.json",
          "record_id": "d32.westmeath.st-fechin-fore"
        },
        "atlas_placement_ids": [
          "atlas.westmeath.10.uisce"
        ],
        "place": {
          "id": "d32.westmeath.place",
          "label": "an Iarmhí / Westmeath"
        },
        "setting": "present_day",
        "learner_role": "present_day_self"
      },
      "learning": {
        "stages": [
          "introduction"
        ],
        "roles": [
          "story_opening"
        ],
        "dialect": "standard Irish; provisional county context",
        "register": "neutral pedagogical frame",
        "purpose": "Open the westmeath story with the atlas-bound water at its named place.",
        "fixture_only": false
      },
      "exercise_consumers": [
        {
          "path": "content/audio/authoring/d32-county-harvest-uses.json",
          "record_id": "d32.westmeath.st-fechin-fore.opening.10",
          "response_family": "listenChoose",
          "container": "none",
          "use": "Open the westmeath story with the atlas-bound water at its named place."
        }
      ],
      "provenance": {
        "origin": "invented_pedagogical",
        "invented": true,
        "composition_note": "Deterministically composed from the provisional atlas gloss and the county story-slate place binding for the D32 emergency harvest; not attested text.",
        "source_refs": [
          {
            "path": "content/audio/authoring/d32-county-harvest-uses.json",
            "record_id": "d32.westmeath.st-fechin-fore.opening.10",
            "supports": "exercise_context"
          }
        ]
      },
      "states": {
        "authoring": {
          "status": "complete",
          "revision": 1,
          "author_ref": "track-a.d32-scale-authoring",
          "completed_at": "2026-08-02"
        },
        "reviews": {
          "editorial": {
            "status": "pending",
            "record": null
          },
          "pedagogy": {
            "status": "pending",
            "record": null
          },
          "irish_language": {
            "status": "pending",
            "record": null
          }
        },
        "capture_request": {
          "status": "requested",
          "requested_by": "codex.track-a.d32",
          "requested_at": "2026-08-02T10:52:00Z",
          "authorization": {
            "basis": "d32_emergency_harvest",
            "authorized_by": "user.d32.scale.019fc1ba",
            "authorized_at": "2026-08-02T10:52:00Z",
            "reason": "Explicit D32 emergency-harvest authorization for provisional capture; review and learner release remain blocked.",
            "fixture_only": false,
            "harvest_deadline": "2026-08-11",
            "learner_release_blocked": true
          },
          "batch_line_ids": [
            "d32.harvest.carlow.d32-carlow-st-moling.part-02.line.e3c8ded7ac5f21a6"
          ]
        },
        "audio_qa": {
          "status": "not_generated",
          "record": null,
          "batch_line_id": null
        },
        "learner_release": {
          "status": "blocked",
          "reasons": [
            "invented_text",
            "editorial_review_pending",
            "pedagogy_review_pending",
            "irish_language_review_pending",
            "audio_not_generated"
          ]
        }
      },
      "risk_flags": [
        "audio_pronunciation",
        "fada",
        "invented_text",
        "source_ambiguity"
      ]
    },
    {
      "id": "d32.westmeath.10.uisce.water.recap",
      "family_id": "d32.westmeath.10.uisce.water",
      "target": {
        "lexeme_id": "lex.uisce",
        "citation_form": "uisce",
        "sense_id": "westmeath.uisce.water",
        "part_of_speech": "noun",
        "target_form": "uisce",
        "morphology": "atlas citation form; provisional surrounding frame"
      },
      "irish": {
        "text": "Féach ar uisce.",
        "normalized_text": "Féach ar uisce.",
        "inventory_slug": "feeach-ar-uisce",
        "text_sha256": "ce8637685fd25bf4baf929807579109b1c37e62e1a0efb7530022185d73db2b7"
      },
      "english": {
        "intent": "Look at the water.",
        "literal_note": "D32 invented pedagogical line; not an attested quotation."
      },
      "binding": {
        "county": "westmeath",
        "story_ref": {
          "path": "content/audio/authoring/d32-county-harvest-uses.json",
          "record_id": "d32.westmeath.st-fechin-fore"
        },
        "atlas_placement_ids": [
          "atlas.westmeath.10.uisce"
        ],
        "place": {
          "id": "d32.westmeath.place",
          "label": "an Iarmhí / Westmeath"
        },
        "setting": "present_day",
        "learner_role": "present_day_self"
      },
      "learning": {
        "stages": [
          "later_reuse"
        ],
        "roles": [
          "story_recap"
        ],
        "dialect": "standard Irish; provisional county context",
        "register": "neutral pedagogical frame",
        "purpose": "Recap the water placement with a short present-day instruction.",
        "fixture_only": false
      },
      "exercise_consumers": [
        {
          "path": "content/audio/authoring/d32-county-harvest-uses.json",
          "record_id": "d32.westmeath.st-fechin-fore.recap.10",
          "response_family": "freeTyping",
          "container": "none",
          "use": "Recap the water placement with a short present-day instruction."
        }
      ],
      "provenance": {
        "origin": "invented_pedagogical",
        "invented": true,
        "composition_note": "Deterministically composed from the provisional atlas gloss and the county story-slate place binding for the D32 emergency harvest; not attested text.",
        "source_refs": [
          {
            "path": "content/audio/authoring/d32-county-harvest-uses.json",
            "record_id": "d32.westmeath.st-fechin-fore.recap.10",
            "supports": "exercise_context"
          }
        ]
      },
      "states": {
        "authoring": {
          "status": "complete",
          "revision": 1,
          "author_ref": "track-a.d32-scale-authoring",
          "completed_at": "2026-08-02"
        },
        "reviews": {
          "editorial": {
            "status": "pending",
            "record": null
          },
          "pedagogy": {
            "status": "pending",
            "record": null
          },
          "irish_language": {
            "status": "pending",
            "record": null
          }
        },
        "capture_request": {
          "status": "requested",
          "requested_by": "codex.track-a.d32",
          "requested_at": "2026-08-02T10:52:00Z",
          "authorization": {
            "basis": "d32_emergency_harvest",
            "authorized_by": "user.d32.scale.019fc1ba",
            "authorized_at": "2026-08-02T10:52:00Z",
            "reason": "Explicit D32 emergency-harvest authorization for provisional capture; review and learner release remain blocked.",
            "fixture_only": false,
            "harvest_deadline": "2026-08-11",
            "learner_release_blocked": true
          },
          "batch_line_ids": [
            "d32.harvest.carlow.d32-carlow-st-moling.part-01.line.5606e249a1eb35c2"
          ]
        },
        "audio_qa": {
          "status": "not_generated",
          "record": null,
          "batch_line_id": null
        },
        "learner_release": {
          "status": "blocked",
          "reasons": [
            "invented_text",
            "editorial_review_pending",
            "pedagogy_review_pending",
            "irish_language_review_pending",
            "audio_not_generated"
          ]
        }
      },
      "risk_flags": [
        "audio_pronunciation",
        "fada",
        "invented_text",
        "source_ambiguity"
      ]
    }
  ]
}
